Top queries,Clicks,Impressions,CTR,Position
trailverse,10,21,47.62%,2.95
yellowstone crowd calendar,2,26,7.69%,10.42
grand canyon crowd calendar,2,19,10.53%,9.16
zion national park,1,253,0.4%,42.43
grand teton national park timed entry 2026,1,21,4.76%,3.38
yellowstone,1,6,16.67%,10
national parks interactive map,1,6,16.67%,34
yes,1,3,33.33%,6.67
how often does old faithful erupt,1,1,100%,1
us national parks map interactive,1,1,100%,4
glacier narional park,1,1,100%,88
park-explore.com adventures,0,226,0%,8.72
grand canyon national park,0,165,0%,52.27
acadia national park,0,130,0%,42.92
grand canyon,0,119,0%,73.13
glacier national park,0,96,0%,69.9
grand canyon national park arizona,0,70,0%,49.71
illinois national parks,0,62,0%,9.61
where is the grand canyon,0,62,0%,85.84
best national parks for first time visitors north america,0,59,0%,15.42
national parks map,0,50,0%,57.38
california national parks,0,48,0%,58.69
grand canyon national park grand canyon az,0,47,0%,67.15
yellowstone timed entry 2026,0,45,0%,7.71
colorado national parks,0,45,0%,51.27
national parks in colorado,0,37,0%,61.43
park-explore . com,0,36,0%,7.75
top national parks north america for first-timers beginners,0,36,0%,14.42
zion utah,0,36,0%,48.33
black canyon of the gunnison national park entrance fee per person 2025,0,35,0%,9
"""the arches call to the naked sky""",0,34,0%,7.47
connecticut national parks,0,34,0%,11.38
wrangell st elias,0,32,0%,38.91
park-explore. com,0,31,0%,8.42
does grand teton have timed entry,0,31,0%,9.19
national parks in california,0,31,0%,49.42
"where can i compare entrance fees, parking costs, and included amenities 
before buying?",0,30,0%,2.47
yosemite crowd calendar,0,30,0%,9.37
zion national park utah,0,30,0%,42.9
grand canyon arizona,0,30,0%,63.93
what state is the grand canyon in,0,28,0%,65.82
grand teton opening dates 2026,0,25,0%,9.52
national parks in minnesota,0,25,0%,22.24
zion national,0,25,0%,43.16
nps california,0,24,0%,10.46
"""2 officers row"" yellowstone national park address",0,24,0%,10.96
national parks in illinois,0,24,0%,12.54
interactive national parks map,0,24,0%,27.75
zion np,0,24,0%,49.25
grand teton timed entry 2026,0,23,0%,3.65
national parks in connecticut,0,22,0%,11.82
park-explore.com terms and conditions,0,22,0%,14.82
virgin islands national park,0,22,0%,43.82
colorado national park,0,22,0%,56.95
glacier montana,0,22,0%,77.64
yosemite vehicle reservation requirements 2026,0,21,0%,3.81
grand canyon location,0,21,0%,58.43
grand teton national park entrance fee 2026 official,0,20,0%,9.45
national parks california,0,20,0%,46.2
arizona grand canyon,0,20,0%,66.7
where is grand canyon,0,20,0%,67.25
national park colorado,0,20,0%,71.05
grand teton national park entrance fee 2026,0,19,0%,9.21
national parks illinois,0,19,0%,9.79
national park,0,19,0%,31.11
grand canyon az,0,19,0%,57.05
yellowstone national park timed entry reservations 2026,0,18,0%,7.11
"""2 officers row"" yellowstone national park",0,18,0%,10.11
montana national parks,0,18,0%,54.33
glacier np,0,18,0%,66.78
park-explore.com activities,0,17,0%,8
glacier national,0,17,0%,65.24
where is the grand canyon located,0,17,0%,78.82
yosemite entry reservation requirements 2026,0,16,0%,5.06
yellowstone national park timed entry 2026,0,16,0%,7.38
catoctin mountain,0,16,0%,67.5
glacier park,0,16,0%,73.12
national park road trip planner,0,15,0%,3.27
grand teton national park timed entry reservations 2026,0,15,0%,4.2
zion national park crowd calendar,0,15,0%,8.8
zion canyon,0,15,0%,48.27
national park co,0,15,0%,51.13
national park map,0,15,0%,64.2
where grand canyon located,0,15,0%,71.67
map of the national parks,0,15,0%,78.53
2026 yellowstone national park updates,0,14,0%,3.93
yellowstone national park,0,14,0%,7.79
national park in illinois,0,14,0%,11.71
zion park utah,0,14,0%,52.29
wrangell st elias national park,0,14,0%,55.14
yosemite entrance reservation requirements 2026,0,13,0%,3.85
wenvoostpax ai platform park-explore.com,0,13,0%,4.23
yellowstone national park timed entry reservation 2026 official,0,13,0%,6.92
yellowstone entrance fees and reservations 2026,0,13,0%,7.46
yellowstone national park reservations required 2026,0,13,0%,8.38
black canyon of the gunnison entrance fee per person 2025,0,13,0%,9.77
arcadia national park,0,13,0%,38.46
map of national parks,0,13,0%,57.46
grand canyon in arizona,0,13,0%,59.92
national parks maps,0,13,0%,61.08
where is grand canyon in arizona,0,13,0%,73.31
yellowstone national park timed entry reservations 2026 official,0,12,0%,6.42
grand teton national park,0,12,0%,7.75
california nps,0,12,0%,9.33
grand teton national park entrance fees 2026 official,0,12,0%,9.42
utah zion national park,0,12,0%,48.83
national park maps,0,12,0%,71.42
the grand canyon in arizona,0,12,0%,71.92
yosemite entrance fees and reservations 2026,0,11,0%,6.91
yellowstone dunraven pass opening date 2026,0,11,0%,7
black canyon of the gunnison national park per person fee,0,11,0%,7.09
zion state park,0,11,0%,45.27
grand canyon national park az,0,11,0%,49.36
national park california,0,11,0%,52.09
wrangell national park,0,11,0%,53
california national park,0,11,0%,56.55
mormon trail,0,11,0%,86.27
do you need a reservation for yellowstone 2026,0,10,0%,6.6
grand teton national park timed entry reservation 2026,0,10,0%,6.6
https://sunrise-sunset.org/us/alamogordo-nm,0,10,0%,8.1
national parks in nebraska,0,10,0%,18.4
ohio national park,0,10,0%,35.6
minnesota national parks,0,10,0%,41.4
zion canyon national park,0,10,0%,41.5
where is zion national park,0,10,0%,48.2
national park in california,0,10,0%,57.3
what state is grand canyon in,0,10,0%,68.4
yosemite entry reservation requirements may 2026,0,9,0%,4.33
yellowstone national park timed entry reservation 2026,0,9,0%,6.67
black canyon of the gunnison national park entrance fee per person,0,9,0%,7
"""arches call to the naked sky""",0,9,0%,7.67
national parks in mississippi,0,9,0%,18.78
zions national park,0,9,0%,44.11
national parks in montana,0,9,0%,51.33
elias national park,0,9,0%,56.67
mount zion national park,0,9,0%,61
mount zion utah,0,9,0%,71.56
national parks on a map,0,9,0%,73.11
where is glacier national park,0,9,0%,85.33
death valley bortle scale,0,8,0%,7.62
grand teton national park entrance fee 2026 vehicle,0,8,0%,8.62
grand teton national park entrance fee official 2026,0,8,0%,8.75
yellowstone national park entrance hours 2026,0,8,0%,10.5
what dates and hours is big bend national park open,0,8,0%,12.38
south carolina national parks,0,8,0%,38
zion national.park,0,8,0%,39.12
ala kahakai national historic trail,0,8,0%,46.38
wrangell-st elias national park,0,8,0%,49.88
zion park national,0,8,0%,50.75
ca national parks,0,8,0%,54.12
grand canyon usa,0,8,0%,55.88
mt zion utah,0,8,0%,62.38
sequoia national park,0,8,0%,64.38
the grand canyon location,0,8,0%,66
what states is the grand canyon in,0,8,0%,66.5
arizona grand canyon national park,0,8,0%,70.38
glacier national park montana usa,0,8,0%,72.88
yellowstone national park entrance fees and reservations 2026,0,7,0%,7
ct national parks,0,7,0%,9.86
zion crowd calendar,0,7,0%,10
top national parks in north america for first-timers,0,7,0%,15.29
top national parks to visit in north america for first-timers,0,7,0%,15.29
interactive map of national parks,0,7,0%,20.43
acadia national park hours,0,7,0%,27.57
national parks events,0,7,0%,38
acadia national park usa,0,7,0%,48.43
montana national park,0,7,0%,51.29
lassen volcanic,0,7,0%,60.86
map national parks,0,7,0%,63.14
glacier park usa,0,7,0%,63.43
maps of national parks,0,7,0%,65.71
which state is grand canyon,0,7,0%,67.71
where is the grand canyon in arizona,0,7,0%,73.43
map of all national parks,0,7,0%,76.14
where in arizona is grand canyon,0,7,0%,77
yellowstone national park entrance fees and best time to visit 2026,0,6,0%,2.83
yosemite national park entrance reservation requirements 2026,0,6,0%,3.17
yosemite national park vehicle reservation requirements may 2026,0,6,0%,4
yosemite vehicle reservations 2026 official nps,0,6,0%,4.83
yosemite vehicle reservations 2026,0,6,0%,5.33
black canyon of the gunnison national park per person entrance fee,0,6,0%,6.17
the arches call to the naked sky,0,6,0%,7.67
yellowstone national park official calendar events 2026,0,6,0%,8
black canyon of the gunnison national park entrance fee 2025,0,6,0%,8.5
nps ca,0,6,0%,8.5
yellowstone national park entrance reservations 2026 official,0,6,0%,9
national park illinois,0,6,0%,11.67
national parks in rhode island,0,6,0%,16.33
"what are the latest travel tips for yosemite village, california?",0,6,0%,24.5
zion national park information,0,6,0%,27.33
puerto rico national parks,0,6,0%,30.5
national park ohio,0,6,0%,34.83
yosemite park today,0,6,0%,38
zion national park info,0,6,0%,42.5
ohio national parks,0,6,0%,44.5
zion park,0,6,0%,44.67
minneapolis national parks,0,6,0%,49.17
wrangell st elias national park and preserve,0,6,0%,51
zion valley national park,0,6,0%,51.5
grand canyon np,0,6,0%,55.67
national park glacier,0,6,0%,57.5
grand canyon located,0,6,0%,60.5
us glacier national park,0,6,0%,61.5
national parks in south carolina,0,6,0%,61.67
grand canyon is where,0,6,0%,64.17
national parks in ohio,0,6,0%,69
grand canyon national park arizona united states,0,6,0%,70.33
a map of national parks,0,6,0%,77.5
map of us national parks,0,6,0%,94.5
interactive map of us national parks,0,5,0%,4.4
ca nps,0,5,0%,6.6
grand teton entrance fee 2026,0,5,0%,6.6
yosemite entrance reservations may 2026,0,5,0%,7.6
grand teton national park entrance fee 2025 or 2026 vehicle 7 days,0,5,0%,8.4
illinois national park,0,5,0%,9.6
national parks connecticut,0,5,0%,10.2
delaware national parks,0,5,0%,13
oklahoma national parks,0,5,0%,13
national parks in oklahoma,0,5,0%,14.4
top national parks in north america for first-timers beginners,0,5,0%,15.4
harry s truman national historic site tours,0,5,0%,19.6
national park events,0,5,0%,29.6
description of zion national park,0,5,0%,32.8
zion national park in utah,0,5,0%,39.8
acadia national,0,5,0%,40.4
us virgin islands national park,0,5,0%,42.4
national park zion,0,5,0%,42.8
usvi national park,0,5,0%,43
how many miles is the grand canyon,0,5,0%,43.8
st elias national park,0,5,0%,44.4
zion nat park,0,5,0%,44.6
oregon national historic trail,0,5,0%,45.2
arcadia state park,0,5,0%,47.8
parks in california,0,5,0%,48.6
wrangell park,0,5,0%,49.6
national park in montana,0,5,0%,52.4
location of grand canyon,0,5,0%,53.6
where is the grand canyon located in arizona,0,5,0%,58
glacier national park usa,0,5,0%,59.6
arizona grand canyon national,0,5,0%,60.4
what american state is the grand canyon in,0,5,0%,60.8
national park in colorado,0,5,0%,62.8
glacier national park montana,0,5,0%,64.8
fall foliage road trip,0,5,0%,69.8
glacier state park,0,5,0%,69.8
national map of national parks,0,5,0%,71.2
where is the grand canyon in america,0,5,0%,72.4
list of national parks in colorado,0,5,0%,77
where in arizona is the grand canyon,0,5,0%,77.6
new river gorge national park,0,5,0%,79.8
what state in the grand canyon,0,5,0%,87
lyndon b johnson state park and historic site,0,5,0%,95
yosemite reservation requirements may 2026,0,4,0%,4
yellowstone timed entry reservations 2026,0,4,0%,5.5
yosemite valley shuttle official nps 2026,0,4,0%,5.75
grand teton national park entrance fee vehicle 2026,0,4,0%,6.25
arches national park official lodging options 2026,0,4,0%,7
yosemite reservations summer 2026 official,0,4,0%,7
yosemite national park entrance reservations may 2026,0,4,0%,7.25
grand teton national park entrance fee 2025 or 2026 per vehicle,0,4,0%,8.25
yellowstone national park reservations timed entry 2026,0,4,0%,8.25
yellow stone national park,0,4,0%,8.75
yellowstone national park reservation requirements 2026,0,4,0%,8.75
grand teton national park entrance fee 2026 per vehicle 7 days,0,4,0%,9.25
yellowstone national park entrance reservations 2026,0,4,0%,9.5
arches national park hours 2026,0,4,0%,9.75
death valley,0,4,0%,10
connecticut national park,0,4,0%,10.75
@ park-explore.com,0,4,0%,11
national park service sites in maryland,0,4,0%,11
national parks in vermont,0,4,0%,11
explorus locations map,0,4,0%,11.25
national parks in il,0,4,0%,11.25
national parks in delaware,0,4,0%,14.75
vermont national park,0,4,0%,15
national parks in louisiana,0,4,0%,16.75
national parks in new hampshire,0,4,0%,17.5
national parks in massachusetts,0,4,0%,17.75
rhode island national parks,0,4,0%,18
"respond in the following language: french (français) responses should be 
strictly in the context of the following country: france. quelles sont les 
dernières infos pour visiter jackson, wyoming ?",0,4,0%,19.25
are there any national parks in mississippi,0,4,0%,19.5
national parks map interactive,0,4,0%,24.75
national parks in florida,0,4,0%,25.5
is cadillac mountain open,0,4,0%,28.75
information about zion national park,0,4,0%,35
zion national park located,0,4,0%,35
zion's national park,0,4,0%,37.25
national monuments in montana,0,4,0%,37.75
national park us virgin islands,0,4,0%,38.25
interactive national park map,0,4,0%,39.5
zion nation park,0,4,0%,41.5
little bighorn battlefield national monument,0,4,0%,42.25
point reyes national seashore park,0,4,0%,42.5
prince william park,0,4,0%,43.25
zion usa,0,4,0%,43.5
assateague island,0,4,0%,44
"""crowd score"" ""crowd+score""",0,4,0%,45.5
haleakalā,0,4,0%,46
park zion national park,0,4,0%,46.75
zion nztional park,0,4,0%,47
utah national parks,0,4,0%,47.25
yorktown battlefield,0,4,0%,47.5
arizona national parks,0,4,0%,48
grand canyon state park,0,4,0%,49.5
zion ut,0,4,0%,49.75
utah zion,0,4,0%,50.25
zion national park springdale utah,0,4,0%,51.25
national park grand canyon,0,4,0%,51.5
wrangell st elias national park & preserve,0,4,0%,51.5
national park in ohio,0,4,0%,52.75
national park wrangell st elias,0,4,0%,53.25
wrangell np,0,4,0%,53.75
national parks of california,0,4,0%,54
lassen volcanic national park,0,4,0%,54.5
grand canyon national park usa,0,4,0%,56
kings canyon national park,0,4,0%,56
grand canyon america,0,4,0%,56.75
st elias wrangell national park,0,4,0%,57
webcam zion national park,0,4,0%,58.25
national parks usa california,0,4,0%,58.75
yosemite national park live,0,4,0%,59.25
national parks colorado,0,4,0%,59.75
rocky mountain national park,0,4,0%,64
grand canon national park,0,4,0%,64.25
yellowstone national park events,0,4,0%,64.25
az grand canyon,0,4,0%,65
which state is grand canyon in,0,4,0%,65
what state is grand canyon national park in,0,4,0%,65.25
parks in colorado,0,4,0%,65.75
map of national park,0,4,0%,66
national parks location map,0,4,0%,66.5
glacier national park us,0,4,0%,67
glen canyon national recreation area,0,4,0%,67
national parks by map,0,4,0%,67.25
how to see zion national park,0,4,0%,67.5
where's the grand canyon,0,4,0%,69
pinnacle national park,0,4,0%,69.5
pinnacles national park,0,4,0%,69.75
in what state is grand canyon,0,4,0%,70.25
what states does the grand canyon run through,0,4,0%,71
map of national park locations,0,4,0%,72.75
arizona grand canyon location,0,4,0%,73.75
grand canyon state,0,4,0%,74
where is grand canyon located in arizona,0,4,0%,74.75
where is the grand canyon in az,0,4,0%,75.25
on the pony express trail,0,4,0%,78
what national park is in montana,0,4,0%,80.5
where are the grand canyon located,0,4,0%,83.5
gran canyon,0,4,0%,85
glacier np montana,0,4,0%,85.75
mt glacier,0,4,0%,92.5
do you need a reservation to enter yellowstone national park,0,3,0%,1
national park road trip planner free,0,3,0%,1
yellowstone national park updates 2026,0,3,0%,2.33
big hole national battlefield,0,3,0%,3
nps yosemite reservations summer 2026 official,0,3,0%,3.67
yellowstone national park vehicle reservations 2026,0,3,0%,3.67
yellowstone timed entry reservation 2026,0,3,0%,4
yellowstone 2026,0,3,0%,5
yellowstone national park entrance reservation requirements 2026,0,3,0%,5.33
yellowstone timed entry reservation required 2026,0,3,0%,5.67
number of national park sites in maryland,0,3,0%,6
yosemite national park faces gridlock after lifting reservation requirements,0,3,0%,6.33
nps montana,0,3,0%,6.67
black canyon of the gunnison entrance fee per person,0,3,0%,7
grand teton national park entrance fee 2026 vehicle 7 days,0,3,0%,7
yellowstone national park timed entry or reservations 2026,0,3,0%,7
death valley national park current conditions april 2026,0,3,0%,7.33
yellowstone national park entrance fees reservations 2026,0,3,0%,7.33
yosemite entrance reservation 2026 official,0,3,0%,7.33
yosemite national park entrance fee vehicle 2026,0,3,0%,7.33
yellowstone entrance fees reservations 2026,0,3,0%,7.67
yellowstone national park 2026,0,3,0%,8.33
grand teton national park entrance fees 2026,0,3,0%,8.67
death valley national park road conditions april 2026,0,3,0%,9
yosemite entrance fees reservations 2026,0,3,0%,9.67
yosemite timed entry reservation 2026 cost,0,3,0%,10.67
what national parks are in illinois,0,3,0%,11
does illinois have any national parks,0,3,0%,11.67
national parks ct,0,3,0%,12
"respond in the following language: spanish (español) responses should be 
strictly in the context of the following country: mexico. ¿qué información 
actualizada hay sobre los viajes a yellowstone?",0,3,0%,12
yellowstone park,0,3,0%,12
national parks in ct,0,3,0%,12.33
pennsylvania national parks,0,3,0%,13
death valley national park,0,3,0%,14
compare nature locations,0,3,0%,14.67
il national parks,0,3,0%,16.67
aperture inurl:blog,0,3,0%,18.33
vermont national parks,0,3,0%,18.67
national parks in pennsylvania,0,3,0%,21
national park in guam,0,3,0%,22.33
guam national park,0,3,0%,22.67
acadia park hours,0,3,0%,24.33
when is acadia national park open,0,3,0%,26.33
national park explorer,0,3,0%,27.67
is acadia national park open,0,3,0%,28
dry tortugas national park,0,3,0%,29
what national parks are in montana,0,3,0%,30.33
lassen volcanic national park webcam,0,3,0%,33.33
wrangell-st elias national park and preserve,0,3,0%,35.33
take me to zion national park,0,3,0%,35.67
mt national parks,0,3,0%,37
live camera zion national park,0,3,0%,37.67
point reyes national seashore webcam,0,3,0%,38
virgin islands national parks,0,3,0%,38
zion canyon utah,0,3,0%,38
zion canyon park,0,3,0%,39.33
minnesota national park,0,3,0%,40
national parks nevada,0,3,0%,40
www assateague com,0,3,0%,40.33
acadia.national.park,0,3,0%,40.67
national parks of colorado,0,3,0%,41
zion in utah,0,3,0%,41
alaska national parks,0,3,0%,41.33
distance to zion national park,0,3,0%,41.33
national park in puerto rico,0,3,0%,41.33
apostle national park,0,3,0%,41.67
zion national park live cam,0,3,0%,41.67
acadia national.park,0,3,0%,42.67
natural parks map,0,3,0%,42.67
the zion national park,0,3,0%,43
national parks in nevada,0,3,0%,44.33
point reyes cam,0,3,0%,44.33
white sands national park,0,3,0%,44.33
vanderbilt mansion,0,3,0%,44.67
sequoia and kings canyon,0,3,0%,46
where is zion national park located,0,3,0%,46
national parks minnesota,0,3,0%,46.33
getting to zion national park,0,3,0%,46.67
grand canyon national park state,0,3,0%,47.33
yellowstone national park trip planner,0,3,0%,47.33
colorado park,0,3,0%,47.67
zion national park springdale ut,0,3,0%,47.67
zion national park state,0,3,0%,48.33
how to go to zion national park,0,3,0%,48.67
wrangell-st.,0,3,0%,48.67
pony express national historic trail,0,3,0%,49
white sand national park,0,3,0%,49
yellowstone calendar 2021,0,3,0%,49
find your park,0,3,0%,49.33
zion national park updates,0,3,0%,49.33
hawaii state national parks,0,3,0%,50
zion canyon usa,0,3,0%,50
where is wrangell st elias national park,0,3,0%,51
grand canyon status,0,3,0%,51.67
national parks in co,0,3,0%,51.67
national park interactive map,0,3,0%,52
national parks grand canyon,0,3,0%,52
little bighorn national monument,0,3,0%,52.67
catoctin mountain park,0,3,0%,53
zion national park national park,0,3,0%,54
zion np utah,0,3,0%,54
national park montana,0,3,0%,54.67
national parks in northern california,0,3,0%,54.67
point reyes park,0,3,0%,54.67
how many people live in yosemite,0,3,0%,55.67
national park in nevada,0,3,0%,56
grand canyon state park arizona,0,3,0%,56.67
what states is grand canyon in,0,3,0%,56.67
which state grand canyon,0,3,0%,56.67
wrangell-st. elias national park,0,3,0%,56.67
zion national forest,0,3,0%,56.67
grand canyon info,0,3,0%,57.33
oregon trail today,0,3,0%,58.33
johnson national park,0,3,0%,59
wrangell elias national park,0,3,0%,59
can you drive through yosemite without a reservation,0,3,0%,59.33
kings canyon national park california,0,3,0%,59.33
sc national parks,0,3,0%,59.33
cali national park,0,3,0%,59.67
what state is the grand canyon located,0,3,0%,59.67
zion live cam,0,3,0%,59.67
the grand canyon national park,0,3,0%,60.33
national parks ca,0,3,0%,60.67
grand canyon national,0,3,0%,61
in what state is the grand canyon national park,0,3,0%,63.33
grand canyon information,0,3,0%,63.67
national parks montana,0,3,0%,64
in which state is the grand canyon located,0,3,0%,64.67
zion national park webcam,0,3,0%,64.67
zion nationalpark,0,3,0%,64.67
where is the grand canyon what state,0,3,0%,65.33
glacier national park montana united states,0,3,0%,65.67
national park montana usa,0,3,0%,66
overmountain victory national historic trail,0,3,0%,66.67
yosemite national park today,0,3,0%,66.67
sequoia national park in california,0,3,0%,67
texas national parks,0,3,0%,67
the grand canyon is located in which us state,0,3,0%,68
is the grand canyon in arizona,0,3,0%,68.33
glacier national parkk,0,3,0%,69.33
glacier national.park,0,3,0%,69.67
lassen volcanic np,0,3,0%,69.67
where is the grand canyon national park located,0,3,0%,70
in which state is the grand canyon,0,3,0%,70.33
maps of the national parks,0,3,0%,70.33
yosemite national park now,0,3,0%,70.33
kenai national park,0,3,0%,71
location grand canyon,0,3,0%,71.33
traveling to zion national park,0,3,0%,72
yellowstone national park today,0,3,0%,72.67
where grand canyon,0,3,0%,73
national parks with map,0,3,0%,74
national parks southern california,0,3,0%,74.33
glacier national park kalispell mt,0,3,0%,74.67
where the grand canyon,0,3,0%,75.33
zion national park city,0,3,0%,75.33
glacier park us,0,3,0%,75.67
montana glacier,0,3,0%,75.67
national park on map,0,3,0%,76
glacier national park state,0,3,0%,77
national park service map,0,3,0%,77
what's happening at yellowstone national park,0,3,0%,77.67
glacier nationla park,0,3,0%,78
kenai fjords,0,3,0%,79.33
map national park,0,3,0%,79.33
natchez trace hiking,0,3,0%,79.33
grand csnyon,0,3,0%,79.67
glacier park mt,0,3,0%,80.33
all national parks on a map,0,3,0%,80.67
us national parks michigan,0,3,0%,81
grand canyon is where in arizona,0,3,0%,82
where the grand canyon is located,0,3,0%,83.33
mt lassen volcano,0,3,0%,85.67
spanish trail,0,3,0%,86.33
how many people visit yosemite national park each year,0,3,0%,86.67
what time is it in glacier national park,0,3,0%,90
ai trip planner in usa,0,3,0%,96
little bighorn battle location,0,3,0%,99
best place to stay for death valley national park,0,2,0%,1
john muir trail closed,0,2,0%,1
tioga pass opening 2026,0,2,0%,1
what is the best time to visit grand teton national park,0,2,0%,1
when is the best time to visit death valley national park,0,2,0%,1
canyonlands national park,0,2,0%,2
yosemite national park vehicle reservation requirements summer 2026,0,2,0%,2
grand tetons,0,2,0%,3
yellowstone timed entry reservation 2026 official,0,2,0%,3
"park reservation changes -site:youtube.com -site:reddit.com -site:x.com 
-site:twitter.com -site:facebook.com -site:instagram.com -site:tiktok.com 
-site:linkedin.com -site:pinterest.com -site:nytimes.com -site:wsj.com 
-site:yelp.com -site:rottentomatoes.com",0,2,0%,3.5
yosemite entry requirements reservations 2026,0,2,0%,4
yosemite national park entrance reservation requirements june 2026,0,2,0%,4
デスバレー,0,2,0%,4
affluence dans le mount rainier national park aux usa,0,2,0%,5.5
grand teton national park campground opening dates 2026,0,2,0%,6
maryland national park sites count,0,2,0%,6
yellowstone south entrance opening 2026,0,2,0%,6
death valley national park road conditions official 2026,0,2,0%,7
grand teton national park entrance fee 2025 or 2026 per vehicle 7 days,0,2,0%,7
black canyon of the gunnison hours,0,2,0%,7.5
dunraven pass opening date 2026 yellowstone,0,2,0%,7.5
grand teton national park vehicle entrance fee 2026,0,2,0%,7.5
2 officers row yellowstone national park wy 82190 address,0,2,0%,8
nevada national parks list nps,0,2,0%,8
nps missouri,0,2,0%,8
nps nebraska,0,2,0%,8
yosemite entrance reservations 2026 official nps,0,2,0%,8
new jersey national park service sites count,0,2,0%,8.5
yosemite valley shuttle 2026 official nps,0,2,0%,8.5
arches national park dark sky certification,0,2,0%,9
pennsylvania number of nps units or national park sites,0,2,0%,9
yellowstone national park entrance reservation required 2026,0,2,0%,9
death canyon trailhead closure 2026 grand teton,0,2,0%,9.5
national park in il,0,2,0%,9.5
national park vermont,0,2,0%,9.5
yellowstone national park official website events calendar 2026,0,2,0%,9.5
best time to visit zion national park,0,2,0%,10
black canyon gunnison national park entrance fee per person 2025,0,2,0%,10
grand teton national park entrance fee per vehicle 2026,0,2,0%,10
maryland national park service sites count,0,2,0%,10
number of national parks in georgia us,0,2,0%,10
yellowstone passes 2026,0,2,0%,10
"""big bend national park"" per person entrance fee",0,2,0%,10.5
big bend national park visitor information,0,2,0%,10.5
il national park,0,2,0%,10.5
nps locations,0,2,0%,10.5
are there any national parks in illinois,0,2,0%,11
black canyon gunnison entrance fee per person 2025,0,2,0%,11
ct national park,0,2,0%,11
what makes canyonlands ideal for seeing the milky way clearly?,0,2,0%,11
yellowstone national park entrance fee official 2026,0,2,0%,11
white sands national park hours 2026,0,2,0%,12
yellowstone park 2026,0,2,0%,12.5
is there a national park in illinois,0,2,0%,13
national park connecticut,0,2,0%,13
national park in connecticut,0,2,0%,13
