Top queries,Clicks,Impressions,CTR,Position
national parks mississippi,0,2,0%,13
national parks in fl,0,2,0%,13.5
how many national parks does montana have,0,2,0%,14
national parks of florida,0,2,0%,18
what national parks are in louisiana,0,2,0%,19
what are the national parks in rhode island,0,2,0%,20
yosemite memorial day weekend 2026,0,2,0%,21.5
national park map interactive,0,2,0%,26.5
rocky mountain nat,0,2,0%,27.5
maine national parks,0,2,0%,28
national parks in pennsylvania usa,0,2,0%,28.5
national parks near new orleans,0,2,0%,28.5
national parks of new mexico and texas,0,2,0%,28.5
oxon cove park,0,2,0%,28.5
explore parks,0,2,0%,29
lonely planet fall road trip 10 national parks 2023,0,2,0%,29.5
rocky mountain nationsl park,0,2,0%,29.5
acadia national park open,0,2,0%,30
live cam zion national park,0,2,0%,30.5
national parks florida,0,2,0%,30.5
us national parks in illinois,0,2,0%,30.5
yellowstone national park alerts,0,2,0%,32.5
zion national park description,0,2,0%,33
national parks in alabama,0,2,0%,33.5
national parks in georgia,0,2,0%,33.5
all california national parks,0,2,0%,34
frederick douglass national historic site,0,2,0%,34
zion national park ut,0,2,0%,34
is acadia national park open year round,0,2,0%,34.5
national parks indiana,0,2,0%,34.5
zion park information,0,2,0%,34.5
south carolina national park,0,2,0%,35.5
acadia national park information,0,2,0%,36
national parks in michigan,0,2,0%,36
wolf trap map,0,2,0%,36
zion live camera,0,2,0%,37
oregon caves national monument,0,2,0%,37.5
what time does acadia national park open,0,2,0%,37.5
wolf trap farm park for the performing arts,0,2,0%,37.5
zion park national park,0,2,0%,37.5
florida national parks,0,2,0%,38
national park virgin islands,0,2,0%,38
zion canyon national park utah,0,2,0%,38
acadia national park season,0,2,0%,38.5
nps grand canyon,0,2,0%,38.5
zion natiional park,0,2,0%,39
status of yellowstone,0,2,0%,39.5
is zion a national park,0,2,0%,40
national park oh,0,2,0%,40
zion national oark,0,2,0%,40.5
zoin national park,0,2,0%,40.5
national park in us virgin islands,0,2,0%,41
yellowstone status,0,2,0%,41
yosemite national park trail conditions,0,2,0%,41
zion mational park,0,2,0%,41
zion nationl park,0,2,0%,41
nps sites map,0,2,0%,41.5
what is zion national park,0,2,0%,41.5
zion national parl,0,2,0%,41.5
zion natural park,0,2,0%,41.5
death valley national,0,2,0%,42
is there a national park in puerto rico,0,2,0%,42
mormon pioneer national historic trail,0,2,0%,42
pt reyes webcam,0,2,0%,42
"zion national park, utah",0,2,0%,42
ca national park,0,2,0%,42.5
national park national park,0,2,0%,42.5
zion nationa park,0,2,0%,42.5
elias national park and preserve,0,2,0%,43
national parks in us virgin islands,0,2,0%,43
tupelo national battlefield,0,2,0%,43
acadia np,0,2,0%,43.5
washington-rochambeau revolutionary route,0,2,0%,43.5
yellowstone national park open time,0,2,0%,43.5
prince william forest park,0,2,0%,44
webcams zion national park,0,2,0%,44
acadia national parm,0,2,0%,44.5
colorado parks,0,2,0%,44.5
national park in the virgin islands,0,2,0%,44.5
zion national park america,0,2,0%,44.5
acadia national partk,0,2,0%,45
glacier us,0,2,0%,45
acaidia national park,0,2,0%,45.5
glacier mt,0,2,0%,45.5
zion natinoal park,0,2,0%,45.5
fdr home park,0,2,0%,46
zion national park events,0,2,0%,46
zion national park us,0,2,0%,46
does alabama have a national park,0,2,0%,46.5
franklin roosevelt historic site,0,2,0%,46.5
yosemite national park events,0,2,0%,46.5
zion national park utah webcam,0,2,0%,46.5
lassen volcanic park,0,2,0%,47
national park in minnesota,0,2,0%,47
national parks in indiana,0,2,0%,47
zion national utah,0,2,0%,47
prince william forest,0,2,0%,47.5
chesapeake & ohio national historic park,0,2,0%,48
national park at california,0,2,0%,48
national.park california,0,2,0%,48
prince williams forest park,0,2,0%,48
springdale national park,0,2,0%,48
national park ca,0,2,0%,48.5
acadeia national park,0,2,0%,49
mary mcleod bethune council house national historic site,0,2,0%,49
national parks in ca,0,2,0%,49
national parks washington state,0,2,0%,49
what time does acadia national park close,0,2,0%,49
grand canyon park,0,2,0%,49.5
longfellow house washington's headquarters national historic site,0,2,0%,49.5
national parks co,0,2,0%,49.5
national parks in sc,0,2,0%,49.5
utah's zion national park,0,2,0%,49.5
zion national park utah usa,0,2,0%,49.5
national parks in california list,0,2,0%,50
vermont parks,0,2,0%,50.5
how to get to zion national park,0,2,0%,51
national parks near ohio,0,2,0%,51
wrangell st elias park,0,2,0%,51
zion national park current conditions,0,2,0%,51
fort sumter park,0,2,0%,51.5
grand canyon location state,0,2,0%,51.5
national monuments in california,0,2,0%,51.5
us national park in california,0,2,0%,51.5
socal national parks,0,2,0%,52
what national park is in california,0,2,0%,52
zions nationalpark,0,2,0%,52
battlefield yorktown,0,2,0%,52.5
little bighorn national,0,2,0%,52.5
national parks south carolina,0,2,0%,53
state and national parks in colorado,0,2,0%,53
how far is zion national park,0,2,0%,53.5
national parks list california,0,2,0%,53.5
wrangell st elias np,0,2,0%,53.5
acadia national park us,0,2,0%,54
arches national park milky way,0,2,0%,54
where is the zion national park located,0,2,0%,54
where is zion national park in utah,0,2,0%,54
yosemite national park current conditions,0,2,0%,54
national park in montana usa,0,2,0%,54.5
echo trail park,0,2,0%,55
lassen np,0,2,0%,55
national park in mn,0,2,0%,55
prince william state park,0,2,0%,55
white sands las cruces,0,2,0%,55
california's national parks,0,2,0%,55.5
grand canyon park arizona,0,2,0%,55.5
mt zion national park,0,2,0%,55.5
mt. zion national park,0,2,0%,55.5
grand canyon park national,0,2,0%,56
grand canyon which state,0,2,0%,56
map with national parks,0,2,0%,56
zion national park live webcam,0,2,0%,56
california's national park,0,2,0%,56.5
acadia national park entrances,0,2,0%,57
lewis and clark national historic trail,0,2,0%,57
national parks mn,0,2,0%,57
zio national park,0,2,0%,57
acadia state park,0,2,0%,57.5
arches star cluster,0,2,0%,57.5
are there any national parks in minnesota,0,2,0%,57.5
arizona's grand canyon,0,2,0%,57.5
grabd canyon national park,0,2,0%,57.5
grand canyon national park grand canyon,0,2,0%,57.5
national parks mapped,0,2,0%,57.5
what city is zion national park in,0,2,0%,57.5
where is zion park,0,2,0%,57.5
glacier np usa,0,2,0%,58
park grand canyon,0,2,0%,58
washington national parks,0,2,0%,58
webcam point reyes,0,2,0%,58
zion national park is in what city,0,2,0%,58.5
grand canyon parashant national monument,0,2,0%,59
yellowstone events,0,2,0%,59
colorado nation parks,0,2,0%,59.5
elias wrangell national park,0,2,0%,59.5
national parks in arizona,0,2,0%,59.5
south carolina national parks map,0,2,0%,59.5
amistad national park,0,2,0%,60
is the statue of liberty a national park,0,2,0%,60
national california parks,0,2,0%,60.5
nationals parks map,0,2,0%,60.5
which state is the grand canyon located in,0,2,0%,60.5
william j clinton birthplace home national historic site,0,2,0%,60.5
acadia park parking,0,2,0%,61
carlsbad caverns,0,2,0%,61
assatague island,0,2,0%,61.5
catoctin state park,0,2,0%,61.5
springdale utah zion national park,0,2,0%,61.5
what state is grand canyon located,0,2,0%,61.5
wrangell elias,0,2,0%,61.5
zion national park is in what state,0,2,0%,62
grand canyons location,0,2,0%,62.5
grand canyon what state,0,2,0%,63
volcanic lassen national park,0,2,0%,63
grand canyon where is it,0,2,0%,63.5
in which state is grand canyon located,0,2,0%,63.5
national park michigan,0,2,0%,63.5
pinnacles national park hollister ca,0,2,0%,63.5
point reyes webcams,0,2,0%,63.5
grand canyon national park information,0,2,0%,64
how crowded is yosemite right now,0,2,0%,64
lassen volcano,0,2,0%,64
nps interactive map,0,2,0%,64
is petrified forest national park open,0,2,0%,64.5
national park of california,0,2,0%,64.5
national parks in southern california,0,2,0%,64.5
springdale to zion national park,0,2,0%,64.5
fall foliage road trips,0,2,0%,65
glacier national park info,0,2,0%,65
which states grand canyon,0,2,0%,65
glacier mountain,0,2,0%,65.5
the grand canyon us,0,2,0%,65.5
location glacier national park,0,2,0%,66
what state is zion national park in,0,2,0%,66
is lassen national park open,0,2,0%,66.5
lassen national park,0,2,0%,66.5
national glacier park usa,0,2,0%,66.5
parks of colorado,0,2,0%,66.5
zion national park cameras,0,2,0%,66.5
zip code yosemite national park,0,2,0%,66.5
colorado state and national parks,0,2,0%,67
grand canyon national park us,0,2,0%,67
what states does the grand canyon cover,0,2,0%,67
glacier national park missoula montana,0,2,0%,67.5
grand canyon which states,0,2,0%,67.5
parks map,0,2,0%,67.5
us state parks map,0,2,0%,67.5
boulder colorado national parks,0,2,0%,68
grand canyon national park arizona usa,0,2,0%,68
in what state is the grand canyon,0,2,0%,68
is it safe to go to yosemite right now,0,2,0%,68
jewel cave hours,0,2,0%,68
national parks in boulder colorado,0,2,0%,68
where is the grand canyon state,0,2,0%,68
yellowstone park today,0,2,0%,68
glacier national park information,0,2,0%,68.5
the grand canyon arizona usa,0,2,0%,68.5
usa montana glacier national park,0,2,0%,68.5
zion national park webcams,0,2,0%,68.5
catoctin mountain state park,0,2,0%,69
louisiana park,0,2,0%,69
map of all national park,0,2,0%,69
where glacier national park,0,2,0%,69
where is glacier park,0,2,0%,69
zion natoonal park,0,2,0%,69
lassen national volcanic park,0,2,0%,69.5
major events in yellowstone national park,0,2,0%,69.5
montezuma castle usa,0,2,0%,69.5
capitol reef ut,0,2,0%,70
grand canyon in what state,0,2,0%,70
grand canyon usa arizona,0,2,0%,70
list of california national parks,0,2,0%,70.5
mt rainier updates,0,2,0%,70.5
pipe springs az,0,2,0%,70.5
park of california,0,2,0%,71
pony express historic trail,0,2,0%,71
the grand canyon america,0,2,0%,71
fall road trip,0,2,0%,72
grand canyon where,0,2,0%,72
maryland catoctin mountain park,0,2,0%,72
national park near grand canyon,0,2,0%,72
grand canyom,0,2,0%,72.5
hot springs np,0,2,0%,72.5
information about grand canyon national park,0,2,0%,72.5
maps of all national parks,0,2,0%,72.5
national parks in colorado map,0,2,0%,72.5
gorge national park,0,2,0%,73
kennesaw mountain,0,2,0%,73
mormon pioneer trails,0,2,0%,73
parques nacionales en colorado,0,2,0%,73
grand canyon is in which state,0,2,0%,73.5
list of ca national parks,0,2,0%,73.5
national parks map usa,0,2,0%,73.5
yellowstone national park yellowstone national park wy,0,2,0%,73.5
co national parks,0,2,0%,74
lewis and clark trail,0,2,0%,74
historic oregon trail,0,2,0%,74.5
national parks of texas,0,2,0%,74.5
vacation to zion national park,0,2,0%,74.5
what states does the grand canyon go through,0,2,0%,74.5
where the grand canyon is,0,2,0%,74.5
montana glacier national,0,2,0%,75
national parks system map,0,2,0%,75
when does acadia national park close,0,2,0%,75
which state is the grand canyon in,0,2,0%,75
driving into zion national park,0,2,0%,75.5
kalaupapa nhp,0,2,0%,75.5
national park mapping,0,2,0%,75.5
where is grand canyon located,0,2,0%,75.5
where is grand canyon national park located,0,2,0%,75.5
california national parks list,0,2,0%,76
catoctin mountain park maryland,0,2,0%,76
montana glacier national park,0,2,0%,76
theodore roosevelt national park in north dakota,0,2,0%,76
yosemite today,0,2,0%,76
is grand canyon in arizona,0,2,0%,76.5
kenai fjords national park,0,2,0%,76.5
glacier mountain park,0,2,0%,77
grand national park,0,2,0%,77
national parks service grand canyon,0,2,0%,77
what us state is the grand canyon located in,0,2,0%,77
zion national park camera,0,2,0%,77
grande canyon,0,2,0%,77.5
what part of arizona is the grand canyon in,0,2,0%,77.5
is zion national park in utah,0,2,0%,78
what national parks are in colorado,0,2,0%,78
where are the grand canyon,0,2,0%,78
national park usa grand canyon,0,2,0%,78.5
national parks in california usa,0,2,0%,78.5
where is the grand canyon in,0,2,0%,78.5
where is the the grand canyon located,0,2,0%,79
map of minnesota national parks,0,2,0%,79.5
national park near south carolina,0,2,0%,79.5
chesapeake ohio canal national park,0,2,0%,80
information on glacier national park,0,2,0%,80
glacier natioanl park,0,2,0%,80.5
grand canyon is in what state,0,2,0%,80.5
kenai fjords np,0,2,0%,80.5
tule springs fossil beds national monument las vegas,0,2,0%,80.5
where the grand canyon located,0,2,0%,80.5
glacier national park where is it,0,2,0%,81
grand canyon where is it located,0,2,0%,81
haleakala national park,0,2,0%,81
location of grand canyon national park,0,2,0%,81
mormon trek,0,2,0%,81
natinoal park map,0,2,0%,81
were is the grand canyon located,0,2,0%,81
glacier national montana,0,2,0%,81.5
glacier national park located,0,2,0%,81.5
what states are the grand canyon in,0,2,0%,81.5
yellowstone conditions,0,2,0%,81.5
catoctin mountains,0,2,0%,82
national park by map,0,2,0%,82
the grand canyon located,0,2,0%,82
california trail,0,2,0%,82.5
national park in map,0,2,0%,82.5
glacier national park united states,0,2,0%,83
national park service grand canyon,0,2,0%,83
catoctin mountains md,0,2,0%,83.5
glacier national park kalispell,0,2,0%,83.5
where is the grand canyon location,0,2,0%,83.5
new river gorge national park and preserve,0,2,0%,84
glacier national park parks,0,2,0%,85
how many people visit grand canyon each year,0,2,0%,86
natioal park map,0,2,0%,86
battle of little bighorn site,0,2,0%,86.5
how many people visit yosemite each year,0,2,0%,86.5
lava beds oregon,0,2,0%,86.5
us national parks south carolina,0,2,0%,87
national parks and forests map,0,2,0%,87.5
wrangell st elias national park & preserve alaska,0,2,0%,87.5
denver national parks,0,2,0%,88
what states does the grand canyon touch,0,2,0%,88
mt lassen volcanic activity,0,2,0%,88.5
how many national parks are in colorado,0,2,0%,90
all the national parks in california,0,2,0%,90.5
cglacier national park,0,2,0%,91
how many square miles is yosemite park,0,2,0%,91
national parks in atlanta georgia,0,2,0%,91
national park and forest map,0,2,0%,91.5
overmountain trail,0,2,0%,93
california national park list,0,2,0%,93.5
how many tourists visit yosemite each year,0,2,0%,95.5
new river gorge national park & preserve,0,2,0%,97
what national parks are in california,0,2,0%,97
yosemite national park current status,0,2,0%,98
which country is the grand canyon in,0,2,0%,99.5
all about death valley national park,0,1,0%,1
arches park,0,1,0%,1
bortle 1 locations,0,1,0%,1
bortle scale 1 locations,0,1,0%,1
death valley activities,0,1,0%,1
do i need a timed entry pass for arches national park,0,1,0%,1
do you need a reservation for grand teton national park,0,1,0%,1
do you need a reservation to get into yellowstone national park,0,1,0%,1
do you need reservations to get into yellowstone national park,0,1,0%,1
how long does it take to drive the north loop of yellowstone,0,1,0%,1
is john muir trail closed,0,1,0%,1
john muir trail closure,0,1,0%,1
like in the us,0,1,0%,1
massachusetts national parks,0,1,0%,1
moab in september,0,1,0%,1
most visited national parks in the us,0,1,0%,1
parque nacional yellowstone,0,1,0%,1
黃石公園,0,1,0%,1
arches nationa park,0,1,0%,2
is it free,0,1,0%,2
more,0,1,0%,2
national parks in montana map,0,1,0%,2
what about 1pm,0,1,0%,2
what to do in arches national park,0,1,0%,2
yellowstone national park visitor information 2026,0,1,0%,2
yellowstone park passes 2026,0,1,0%,2
arches,0,1,0%,3
death valley hotels luxury,0,1,0%,3
does grand teton national park require reservations,0,1,0%,3
fresno,0,1,0%,3
where to stay at death valley,0,1,0%,3
yellowstone national parks,0,1,0%,3
yellowstone park pass 2026,0,1,0%,3
yosemite national park entrance reservation requirements may 2026,0,1,0%,3
arches national park visitor information 2026,0,1,0%,4
best place to stargaze in arches national park,0,1,0%,4
best time?,0,1,0%,4
death canyon trailhead,0,1,0%,4
death valley hotels inside park,0,1,0%,4
death valley national park in california what can you do there,0,1,0%,4
"death valley national park, california",0,1,0%,4
death valley state,0,1,0%,4
more challenges,0,1,0%,4
national park yellowstone,0,1,0%,4
north window,0,1,0%,4
parks-explore com,0,1,0%,4
west virginia national park sites count,0,1,0%,4